{
  "$schema": "./olore.config.schema.json",
  "name": "my-project-docs",
  "version": "1.0.0",
  "description": "Documentation for my project - covers API, setup, and usage guides",
  "contentPath": "./docs",
  "outputPath": "./olore-package",
  "extensions": [".md", ".mdx"],
  "exclude": ["**/drafts/**", "**/internal/**", "**/CHANGELOG.md"]
}
